{
  "annual_incremental_mwh": 843818.1818181818,
  "artefact_family": "IncrementalElectricityPack",
  "artefact_id": "68e5b10b-9a0d-5caf-8a75-f390e3a10bfb",
  "epoch": 2035,
  "future_id": 20,
  "p95_incremental_mw": 123.78421537855188,
  "pathway_id": "2035_EB",
  "peak_incremental_mw": 132.99833179111545,
  "run_id": "ADAPTER-anchor21-realoutput-release02-2035_EB",
  "schema_version": "v1.0-current",
  "site_id": "edendale_fonterra",
  "validation_outcome": "manual_review_required"
}
