{
  "annual_incremental_mwh": 652233.5570333105,
  "artefact_family": "IncrementalElectricityPack",
  "artefact_id": "41a344cf-b2d8-5b97-80eb-ba510c776d37",
  "epoch": 2035,
  "future_id": 3,
  "p95_incremental_mw": 88.41729669896563,
  "pathway_id": "2035_BB",
  "peak_incremental_mw": 94.99880842222532,
  "run_id": "ADAPTER-anchor21-realoutput-release02-2035_BB",
  "schema_version": "v1.0-current",
  "site_id": "edendale_fonterra",
  "validation_outcome": "manual_review_required"
}
