{
  "annual_incremental_mwh": 575151.4093839193,
  "artefact_family": "IncrementalElectricityPack",
  "artefact_id": "3bdbf738-c868-53a1-a74b-68c0e5042120",
  "epoch": 2035,
  "future_id": 11,
  "p95_incremental_mw": 88.41729669896563,
  "pathway_id": "2035_BB",
  "peak_incremental_mw": 94.99880842222532,
  "run_id": "ADAPTER-anchor21-realoutput-release02-2035_BB",
  "schema_version": "v1.0-current",
  "site_id": "edendale_fonterra",
  "validation_outcome": "manual_review_required"
}
