{
  "annual_incremental_mwh": 785909.0909090908,
  "artefact_family": "IncrementalElectricityPack",
  "artefact_id": "4cd38623-7f6e-5397-bd76-5173b0f601d3",
  "epoch": 2035,
  "future_id": 6,
  "p95_incremental_mw": 123.78421537855188,
  "pathway_id": "2035_EB",
  "peak_incremental_mw": 132.99833179111545,
  "run_id": "ADAPTER-anchor21-realoutput-release02-2035_EB",
  "schema_version": "v1.0-current",
  "site_id": "edendale_fonterra",
  "validation_outcome": "manual_review_required"
}
