{
  "annual_incremental_mwh": 569222.0134108892,
  "artefact_family": "IncrementalElectricityPack",
  "artefact_id": "1da76fd1-61cd-5cfb-ab6a-1471b7a1bd7f",
  "epoch": 2035,
  "future_id": 17,
  "p95_incremental_mw": 88.41729669896563,
  "pathway_id": "2035_BB",
  "peak_incremental_mw": 94.99880842222532,
  "run_id": "ADAPTER-anchor21-realoutput-release02-2035_BB",
  "schema_version": "v1.0-current",
  "site_id": "edendale_fonterra",
  "validation_outcome": "manual_review_required"
}
