{
  "annual_incremental_mwh": 628515.9731411901,
  "artefact_family": "IncrementalElectricityPack",
  "artefact_id": "a72b5377-a670-5eb4-ba2f-6c08e17eb2dd",
  "epoch": 2035,
  "future_id": 12,
  "p95_incremental_mw": 88.41729669896563,
  "pathway_id": "2035_BB",
  "peak_incremental_mw": 94.99880842222532,
  "run_id": "ADAPTER-anchor21-realoutput-release02-2035_BB",
  "schema_version": "v1.0-current",
  "site_id": "edendale_fonterra",
  "validation_outcome": "manual_review_required"
}
