{
  "annual_incremental_mwh": 489723.63636363635,
  "artefact_family": "IncrementalElectricityPack",
  "artefact_id": "39bfcd0c-8db2-5f7f-b056-4906f43afdcd",
  "epoch": 2035,
  "future_id": 9,
  "p95_incremental_mw": 83.38017497451146,
  "pathway_id": "2035_BB",
  "peak_incremental_mw": 92.59429138707506,
  "qualification_codes": [
    "FIELD_INVARIANT_ACROSS_FUTURES_WITHIN_PATHWAY"
  ],
  "run_id": "ADAPTER-anchor21-realoutput-canonical_continuous_v1-2035_BB",
  "schema_version": "v1.0-current",
  "site_id": "edendale_fonterra",
  "validation_outcome": "manual_review_required"
}
