{
  "annual_incremental_mwh": 860363.6363636362,
  "artefact_family": "IncrementalElectricityPack",
  "artefact_id": "2f212c8b-f963-542c-a1db-b076813c487e",
  "epoch": 2035,
  "future_id": 15,
  "p95_incremental_mw": 123.78421537855188,
  "pathway_id": "2035_EB",
  "peak_incremental_mw": 132.99833179111545,
  "run_id": "ADAPTER-anchor21-realoutput-release02-2035_EB",
  "schema_version": "v1.0-current",
  "site_id": "edendale_fonterra",
  "validation_outcome": "manual_review_required"
}
