{
  "annual_incremental_mwh": 622586.5771681601,
  "artefact_family": "IncrementalElectricityPack",
  "artefact_id": "cbad987d-a6ae-56a1-b6c2-230727dbd18f",
  "epoch": 2035,
  "future_id": 5,
  "p95_incremental_mw": 88.41729669896563,
  "pathway_id": "2035_BB",
  "peak_incremental_mw": 94.99880842222532,
  "run_id": "ADAPTER-anchor21-realoutput-release02-2035_BB",
  "schema_version": "v1.0-current",
  "site_id": "edendale_fonterra",
  "validation_outcome": "manual_review_required"
}
